,number,value,datetime_start,datetime_complete,duration,params_activation_fn,params_batch_size,params_buffer_size,params_ent_coef,params_gamma,params_learning_rate,params_learning_starts,params_log_std_init,params_net_arch,params_tau,params_train_freq,state
0,0,1982.189697265625,2022-11-14 09:53:03.689316,2022-11-14 11:18:15.666242,0 days 01:25:11.976926,<class 'torch.nn.modules.activation.LeakyReLU'>,64,10000,0.05,0.999,0.0018917317273081467,0,-0.5762509164262744,small,0.005,512,COMPLETE
1,1,3716.125,2022-11-14 11:18:15.666242,2022-11-14 12:48:44.254003,0 days 01:30:28.587761,<class 'torch.nn.modules.activation.ReLU'>,128,10000,0.0001,0.9999,0.001217077872911745,10000,-0.2628629913802101,medium,0.01,16,COMPLETE
2,2,,2022-11-14 12:48:44.254003,2022-11-14 12:50:24.923092,0 days 00:01:40.669089,<class 'torch.nn.modules.activation.ReLU'>,16,10000,auto,0.999,0.20263742547270389,1000,-0.8209161999091936,medium,0.001,256,PRUNED
3,3,2405.4560546875,2022-11-14 12:50:24.938727,2022-11-14 14:20:11.481131,0 days 01:29:46.542404,<class 'torch.nn.modules.activation.ReLU'>,64,1000000,0.5,0.9,0.004834813544254239,20000,0.3701866571607271,medium,0.001,512,COMPLETE
4,4,-3776.92529296875,2022-11-14 14:20:11.481131,2022-11-14 15:44:44.968051,0 days 01:24:33.486920,<class 'torch.nn.modules.activation.Tanh'>,32,10000,0.1,0.9999,0.27742595595844344,20000,-0.31058573292768177,small,0.001,32,COMPLETE
5,5,1947.343505859375,2022-11-14 15:44:44.968051,2022-11-14 17:24:45.875896,0 days 01:40:00.907845,<class 'torch.nn.modules.activation.ELU'>,128,100000,0.0001,0.99,1.689553117439307e-05,10000,-3.065738715460843,big,0.01,16,COMPLETE
6,6,1586.57080078125,2022-11-14 17:24:45.875896,2022-11-14 18:11:15.764645,0 days 00:46:29.888749,<class 'torch.nn.modules.activation.ReLU'>,256,100000,0.01,0.9999,0.00044515187317059336,10000,-2.4739665238513737,medium,0.02,16,PRUNED
7,7,2121.56005859375,2022-11-14 18:11:15.764645,2022-11-14 20:12:41.597190,0 days 02:01:25.832545,<class 'torch.nn.modules.activation.LeakyReLU'>,512,1000000,0.0001,0.95,5.617331942221898e-05,10000,0.8992942044814745,big,0.01,64,COMPLETE
8,8,2357.607177734375,2022-11-14 20:12:41.597190,2022-11-14 22:50:15.922559,0 days 02:37:34.325369,<class 'torch.nn.modules.activation.Tanh'>,2048,10000,0.0001,0.995,0.024332688560206577,1000,-1.8048125948196472,medium,0.08,4,COMPLETE
9,9,-4876.8330078125,2022-11-14 22:50:15.922559,2022-11-14 23:16:45.969173,0 days 00:26:30.046614,<class 'torch.nn.modules.activation.ELU'>,1024,10000,auto,0.98,0.00020978415679306055,0,-1.7280608098512926,medium,0.05,128,PRUNED
10,10,359.1628112792969,2022-11-14 23:16:45.969173,2022-11-14 23:45:08.422128,0 days 00:28:22.452955,<class 'torch.nn.modules.activation.ReLU'>,128,100000,0.1,0.9999,0.01941498562666533,10000,-3.846435940384892,small,0.01,8,PRUNED
11,11,1466.2138671875,2022-11-14 23:45:08.430201,2022-11-14 23:59:14.125297,0 days 00:14:05.695096,<class 'torch.nn.modules.activation.ReLU'>,64,1000000,0.5,0.9,0.005107426964762846,20000,0.6452009155443706,medium,0.001,1,PRUNED
12,12,2829.72021484375,2022-11-14 23:59:14.125297,2022-11-15 01:27:22.965822,0 days 01:28:08.840525,<class 'torch.nn.modules.activation.ReLU'>,64,1000000,0.5,0.9,0.0007308185011609556,20000,0.12249441975403369,medium,0.05,512,COMPLETE
13,13,-796.048828125,2022-11-15 01:27:22.965822,2022-11-15 02:57:11.114935,0 days 01:29:48.149113,<class 'torch.nn.modules.activation.ReLU'>,128,1000000,0.5,0.9,0.0005127832549307153,20000,-0.13343855297425877,medium,0.05,16,COMPLETE
14,14,-1576.14990234375,2022-11-15 02:57:11.114935,2022-11-15 03:15:44.465915,0 days 00:18:33.350980,<class 'torch.nn.modules.activation.ReLU'>,2048,1000000,0.01,0.995,9.825624370163667e-05,20000,-1.1789027121660471,medium,0.05,512,PRUNED
15,15,-1132.437255859375,2022-11-15 03:15:44.465915,2022-11-15 03:49:07.761786,0 days 00:33:23.295871,<class 'torch.nn.modules.activation.ReLU'>,256,10000,0.05,0.99,0.0013964026414295637,10000,0.07143974252624102,big,0.08,1,PRUNED
16,16,1712.4256591796875,2022-11-15 03:49:07.761786,2022-11-15 04:17:43.018485,0 days 00:28:35.256699,<class 'torch.nn.modules.activation.Tanh'>,16,1000000,0.0001,0.95,0.026366235752918098,1000,-1.0361880605029032,medium,0.005,32,PRUNED
17,17,1274.13330078125,2022-11-15 04:17:43.026526,2022-11-15 04:32:14.949987,0 days 00:14:31.923461,<class 'torch.nn.modules.activation.LeakyReLU'>,32,10000,0.5,0.98,4.244993915818801e-05,0,0.27610863247352496,medium,0.02,256,PRUNED
18,18,958.7141723632812,2022-11-15 04:32:14.949987,2022-11-15 04:47:53.691069,0 days 00:15:38.741082,<class 'torch.nn.modules.activation.ELU'>,1024,1000000,0.0001,0.9,0.0006144928588146341,10000,-0.22321647604392436,small,0.01,128,PRUNED
19,19,1660.491455078125,2022-11-15 04:47:53.691069,2022-11-15 05:03:31.970450,0 days 00:15:38.279381,<class 'torch.nn.modules.activation.ReLU'>,512,100000,0.5,0.9999,0.010266038066279504,20000,0.9372487962816054,big,0.05,4,PRUNED
20,20,-5414.00244140625,2022-11-15 05:03:31.970450,2022-11-15 05:17:47.812735,0 days 00:14:15.842285,<class 'torch.nn.modules.activation.ReLU'>,128,1000000,0.05,0.9999,0.08991464312198193,20000,-2.068507773205508,medium,0.05,64,PRUNED
21,21,1540.110107421875,2022-11-15 05:17:47.812735,2022-11-15 05:46:45.023580,0 days 00:28:57.210845,<class 'torch.nn.modules.activation.ReLU'>,64,1000000,0.5,0.9,0.003452384315305521,20000,0.2080929362385927,medium,0.001,512,PRUNED
22,22,503.7821960449219,2022-11-15 05:46:45.031630,2022-11-15 06:00:44.943568,0 days 00:13:59.911938,<class 'torch.nn.modules.activation.ReLU'>,64,1000000,0.5,0.9,0.0011520600758974477,20000,0.5207921449268388,medium,0.001,512,PRUNED
23,23,-386.2586669921875,2022-11-15 06:00:44.951620,2022-11-15 06:14:44.959328,0 days 00:14:00.007708,<class 'torch.nn.modules.activation.ReLU'>,64,1000000,0.5,0.9,0.006314765719379759,20000,-0.44020295158427203,medium,0.01,512,PRUNED
24,24,-3989.06201171875,2022-11-15 06:14:44.961362,2022-11-15 06:28:57.828583,0 days 00:14:12.867221,<class 'torch.nn.modules.activation.ReLU'>,64,1000000,0.5,0.9,0.9161383543329988,20000,-1.2821248413971422,medium,0.08,8,PRUNED
25,25,-2827.546142578125,2022-11-15 06:28:57.828583,2022-11-15 06:43:25.409412,0 days 00:14:27.580829,<class 'torch.nn.modules.activation.ReLU'>,64,10000,auto,0.9,0.0001886771084551452,10000,-0.7024678133814024,medium,0.02,16,PRUNED
26,26,2288.028564453125,2022-11-15 06:43:25.409412,2022-11-15 07:13:20.628279,0 days 00:29:55.218867,<class 'torch.nn.modules.activation.Tanh'>,128,1000000,0.1,0.98,0.002362855414733801,1000,0.460350759922926,medium,0.005,512,PRUNED
27,27,-380.22564697265625,2022-11-15 07:13:20.630323,2022-11-15 07:27:42.179713,0 days 00:14:21.549390,<class 'torch.nn.modules.activation.ELU'>,64,100000,0.01,0.95,0.0008865530109928308,0,0.07726639518558104,small,0.05,512,PRUNED
28,28,333.15557861328125,2022-11-15 07:27:42.179713,2022-11-15 07:47:28.485367,0 days 00:19:46.305654,<class 'torch.nn.modules.activation.LeakyReLU'>,2048,1000000,0.0001,0.995,0.000210364091498953,20000,0.9571689945957339,medium,0.001,16,PRUNED
29,29,-6881.0361328125,2022-11-15 07:47:28.487400,2022-11-15 08:02:27.642865,0 days 00:14:59.155465,<class 'torch.nn.modules.activation.LeakyReLU'>,64,10000,0.05,0.999,0.011571650276974184,0,-0.5760935669254221,big,0.01,512,PRUNED
30,30,-3197.136962890625,2022-11-15 08:02:27.642865,2022-11-15 09:34:18.098492,0 days 01:31:50.455627,<class 'torch.nn.modules.activation.ReLU'>,1024,10000,0.5,0.99,0.0680831316409418,10000,0.47157359323041503,small,0.005,512,COMPLETE
31,31,1347.47998046875,2022-11-15 09:34:18.098492,2022-11-15 10:00:05.451983,0 days 00:25:47.353491,<class 'torch.nn.modules.activation.Tanh'>,2048,10000,0.0001,0.995,0.002315826083778336,1000,-1.6405822064032114,medium,0.08,4,PRUNED
32,32,-2997.958740234375,2022-11-15 10:00:05.451983,2022-11-15 12:42:08.370845,0 days 02:42:02.918862,<class 'torch.nn.modules.activation.Tanh'>,2048,10000,0.0001,0.995,0.03389451338004645,1000,-2.279449941481267,medium,0.08,4,COMPLETE
33,33,3866.79736328125,2022-11-15 12:42:08.370845,2022-11-15 14:10:57.946891,0 days 01:28:49.576046,<class 'torch.nn.modules.activation.Tanh'>,16,10000,0.0001,0.999,0.006248101902097025,1000,-0.814760760421839,medium,0.08,4,COMPLETE
34,34,1848.571044921875,2022-11-15 14:10:57.946891,2022-11-15 14:25:18.745737,0 days 00:14:20.798846,<class 'torch.nn.modules.activation.Tanh'>,16,10000,0.0001,0.999,0.005726205485526598,1000,-0.9345262965346799,medium,0.001,256,PRUNED
35,35,-1812.1011962890625,2022-11-15 14:25:18.745737,2022-11-15 14:39:41.284528,0 days 00:14:22.538791,<class 'torch.nn.modules.activation.Tanh'>,16,10000,auto,0.999,0.0020941541900674184,1000,-0.16717734586328092,medium,0.08,32,PRUNED
36,36,1050.0775146484375,2022-11-15 14:39:41.284528,2022-11-15 14:53:34.524553,0 days 00:13:53.240025,<class 'torch.nn.modules.activation.ReLU'>,16,10000,0.1,0.999,0.00035604943263506335,20000,-0.7464222734001253,medium,0.01,4,PRUNED
37,37,2275.5224609375,2022-11-15 14:53:34.524553,2022-11-15 15:08:08.714282,0 days 00:14:34.189729,<class 'torch.nn.modules.activation.ELU'>,32,100000,0.0001,0.9999,0.0011763084378874145,10000,-0.41655787281577217,big,0.001,16,PRUNED
38,38,-431.1525573730469,2022-11-15 15:08:08.716321,2022-11-15 15:41:39.308631,0 days 00:33:30.592310,<class 'torch.nn.modules.activation.Tanh'>,512,10000,0.01,0.999,0.009627740917508072,1000,-1.3797748318972725,medium,0.02,64,PRUNED
39,39,-5177.798828125,2022-11-15 15:41:39.308631,2022-11-15 15:55:47.497209,0 days 00:14:08.188578,<class 'torch.nn.modules.activation.ReLU'>,256,1000000,0.0001,0.9999,0.00335123605049878,10000,-3.0618022720298472,small,0.08,128,PRUNED
40,40,369.0259704589844,2022-11-15 15:55:47.505246,2022-11-15 16:09:43.557417,0 days 00:13:56.052171,<class 'torch.nn.modules.activation.LeakyReLU'>,16,10000,0.5,0.9,1.3543713580283755e-05,20000,-0.0045545260931383336,medium,0.01,8,PRUNED
41,41,-5480.9697265625,2022-11-15 16:09:43.565456,2022-11-15 16:24:46.862443,0 days 00:15:03.296987,<class 'torch.nn.modules.activation.Tanh'>,128,10000,0.0001,0.995,0.0513520538526728,1000,-1.8539636031228506,medium,0.08,4,PRUNED
42,42,685.03857421875,2022-11-15 16:24:46.862443,2022-11-15 16:50:40.591970,0 days 00:25:53.729527,<class 'torch.nn.modules.activation.Tanh'>,2048,10000,0.0001,0.995,0.12864442870268325,1000,-2.5676972475450777,medium,0.08,4,PRUNED
43,43,3419.547607421875,2022-11-15 16:50:40.600014,2022-11-15 17:20:56.050416,0 days 00:30:15.450402,<class 'torch.nn.modules.activation.Tanh'>,128,10000,0.0001,0.99,0.018515138540002984,1000,0.677536631640834,medium,0.08,4,PRUNED
44,44,734.1044921875,2022-11-15 17:20:56.050416,2022-11-15 17:46:54.573826,0 days 00:25:58.523410,<class 'torch.nn.modules.activation.Tanh'>,2048,10000,0.0001,0.9999,0.2713923144774543,1000,-1.0929656635830518,medium,0.05,1,PRUNED
45,45,-1197.2919921875,2022-11-15 17:46:54.573826,2022-11-15 18:02:09.811392,0 days 00:15:15.237566,<class 'torch.nn.modules.activation.ReLU'>,64,100000,auto,0.95,0.014822839141876201,0,-0.5296889684802609,medium,0.08,16,PRUNED
46,46,1454.958740234375,2022-11-15 18:02:09.819440,2022-11-15 18:17:25.434616,0 days 00:15:15.615176,<class 'torch.nn.modules.activation.ReLU'>,256,1000000,0.1,0.999,0.005002584132534,10000,-1.5465644020963236,medium,0.05,4,PRUNED
47,47,-1336.88037109375,2022-11-15 18:17:25.436653,2022-11-15 18:31:32.109485,0 days 00:14:06.672832,<class 'torch.nn.modules.activation.ELU'>,32,10000,0.5,0.98,0.0006638017000075218,20000,0.3107316846140402,big,0.001,32,PRUNED
48,48,425.639892578125,2022-11-15 18:31:32.109485,2022-11-15 18:45:42.420950,0 days 00:14:10.311465,<class 'torch.nn.modules.activation.Tanh'>,16,1000000,0.05,0.9,0.00031597550358414945,1000,-0.8767103779548923,medium,0.01,256,PRUNED
49,49,-2731.39501953125,2022-11-15 18:45:42.420950,2022-11-15 19:00:10.857235,0 days 00:14:28.436285,<class 'torch.nn.modules.activation.ReLU'>,512,10000,0.0001,0.9999,0.03714306214692696,10000,0.7047412890836738,small,0.005,1,PRUNED
50,50,1096.9476318359375,2022-11-15 19:00:10.857235,2022-11-15 19:16:19.493426,0 days 00:16:08.636191,<class 'torch.nn.modules.activation.ReLU'>,1024,1000000,0.01,0.9,8.315845321550604e-05,20000,-0.2996793044560725,medium,0.05,512,PRUNED
51,51,644.004638671875,2022-11-15 19:16:19.493461,2022-11-15 19:34:27.983066,0 days 00:18:08.489605,<class 'torch.nn.modules.activation.LeakyReLU'>,512,1000000,0.0001,0.95,3.972816870932276e-05,10000,0.741341576208959,big,0.01,64,PRUNED
52,52,-353.43731689453125,2022-11-15 19:34:27.983066,2022-11-15 19:52:49.921431,0 days 00:18:21.938365,<class 'torch.nn.modules.activation.LeakyReLU'>,512,1000000,0.0001,0.95,2.9656325261474827e-05,10000,-0.04820233735538523,big,0.01,64,PRUNED
53,53,247.298583984375,2022-11-15 19:52:49.921431,2022-11-15 20:07:58.697750,0 days 00:15:08.776319,<class 'torch.nn.modules.activation.LeakyReLU'>,128,1000000,0.5,0.95,8.557438868198218e-05,10000,0.29211495668473786,big,0.01,64,PRUNED
54,54,-4734.5478515625,2022-11-15 20:07:58.697750,2022-11-15 20:26:39.259051,0 days 00:18:40.561301,<class 'torch.nn.modules.activation.LeakyReLU'>,512,1000000,0.0001,0.995,0.00804307015425013,10000,-1.8391300742129937,big,0.02,128,PRUNED
55,55,3139.3134765625,2022-11-15 20:26:39.267095,2022-11-15 20:55:33.650669,0 days 00:28:54.383574,<class 'torch.nn.modules.activation.ReLU'>,64,1000000,0.5,0.9,0.0014890736245211332,20000,0.874670736944648,medium,0.01,16,PRUNED
56,56,-4842.6298828125,2022-11-15 20:55:33.658739,2022-11-15 21:11:19.626271,0 days 00:15:45.967532,<class 'torch.nn.modules.activation.ReLU'>,64,100000,0.0001,0.95,0.0033589705829617806,0,0.17259660014660938,big,0.001,64,PRUNED
57,57,538.3223876953125,2022-11-15 21:11:19.626271,2022-11-15 21:30:41.961057,0 days 00:19:22.334786,<class 'torch.nn.modules.activation.LeakyReLU'>,2048,1000000,0.0001,0.98,0.022640503249266326,20000,0.43851275973094933,medium,0.05,512,PRUNED
58,58,1525.5140380859375,2022-11-15 21:30:41.961057,2022-11-15 21:45:49.980414,0 days 00:15:08.019357,<class 'torch.nn.modules.activation.ELU'>,128,1000000,0.5,0.99,1.041314974223703e-05,10000,-0.2889950874622915,medium,0.08,4,PRUNED
59,59,395.0148010253906,2022-11-15 21:45:49.980414,2022-11-15 22:00:39.254867,0 days 00:14:49.274453,<class 'torch.nn.modules.activation.Tanh'>,64,10000,0.05,0.9,0.00012732561365414946,1000,-2.0830505906890338,medium,0.01,8,PRUNED
60,60,872.4998779296875,2022-11-15 22:00:39.254867,2022-11-15 22:28:41.416564,0 days 00:28:02.161697,<class 'torch.nn.modules.activation.ReLU'>,16,1000000,auto,0.9999,0.0007395545214771967,20000,-2.6904771846639988,small,0.001,512,PRUNED
61,61,-5466.31689453125,2022-11-15 22:28:41.416564,2022-11-15 22:42:56.118434,0 days 00:14:14.701870,<class 'torch.nn.modules.activation.LeakyReLU'>,64,10000,0.05,0.999,0.001539271404590788,0,-3.9802678234205446,small,0.005,512,PRUNED
62,62,-2290.3525390625,2022-11-15 22:42:56.118434,2022-11-15 22:57:16.144766,0 days 00:14:20.026332,<class 'torch.nn.modules.activation.LeakyReLU'>,64,10000,0.05,0.999,0.0004709896102631229,0,-0.6429532252538817,small,0.005,512,PRUNED
63,63,-827.7451171875,2022-11-15 22:57:16.144766,2022-11-15 23:11:18.305980,0 days 00:14:02.161214,<class 'torch.nn.modules.activation.LeakyReLU'>,64,10000,0.05,0.999,0.004639147214978891,0,-0.15810041122219148,small,0.005,512,PRUNED
64,64,-3218.6767578125,2022-11-15 23:11:18.305980,2022-11-15 23:27:01.253468,0 days 00:15:42.947488,<class 'torch.nn.modules.activation.LeakyReLU'>,1024,10000,0.1,0.999,0.0009532967586988877,0,-1.355520891135655,small,0.005,16,PRUNED
65,65,-2024.662109375,2022-11-15 23:27:01.253468,2022-11-15 23:41:41.203135,0 days 00:14:39.949667,<class 'torch.nn.modules.activation.ReLU'>,32,10000,0.5,0.9,0.0021504975306225,1000,-0.419730326417633,medium,0.08,256,PRUNED
66,66,-2439.92431640625,2022-11-15 23:41:41.203135,2022-11-15 23:55:47.735276,0 days 00:14:06.532141,<class 'torch.nn.modules.activation.Tanh'>,64,100000,0.0001,0.995,0.007204250478685324,20000,0.1109447968986731,big,0.05,512,PRUNED
67,67,-3838.11669921875,2022-11-15 23:55:47.735276,2022-11-16 00:10:58.430825,0 days 00:15:10.695549,<class 'torch.nn.modules.activation.ReLU'>,256,10000,0.01,0.999,0.012903920135616948,10000,-1.0300707134207965,medium,0.02,4,PRUNED
68,68,-3661.916259765625,2022-11-16 00:10:58.432861,2022-11-16 00:28:42.436827,0 days 00:17:44.003966,<class 'torch.nn.modules.activation.LeakyReLU'>,512,1000000,0.5,0.9999,0.0002849531562478679,0,0.5225143028921191,medium,0.01,32,PRUNED
69,69,650.8555297851562,2022-11-16 00:28:42.438866,2022-11-16 00:45:07.923580,0 days 00:16:25.484714,<class 'torch.nn.modules.activation.Tanh'>,2048,10000,0.0001,0.95,0.00452369306279706,1000,0.9842870780750169,small,0.001,64,PRUNED
70,70,1904.576416015625,2022-11-16 00:45:07.931629,2022-11-16 00:59:16.402179,0 days 00:14:08.470550,<class 'torch.nn.modules.activation.ReLU'>,128,1000000,0.05,0.9,0.0025320899442200953,20000,-0.79277649155009,medium,0.08,128,PRUNED
71,71,-3804.9912109375,2022-11-16 00:59:16.402179,2022-11-16 01:31:30.723889,0 days 00:32:14.321710,<class 'torch.nn.modules.activation.ELU'>,128,100000,0.0001,0.99,3.0256085971914314e-05,10000,-3.2793801261395363,big,0.01,16,PRUNED
72,72,-786.3412475585938,2022-11-16 01:31:30.723889,2022-11-16 01:47:03.385650,0 days 00:15:32.661761,<class 'torch.nn.modules.activation.ELU'>,128,100000,0.0001,0.99,1.7737074514937165e-05,10000,-3.4358862660743617,big,0.01,16,PRUNED
73,73,-1404.54296875,2022-11-16 01:47:03.385650,2022-11-16 02:02:47.651035,0 days 00:15:44.265385,<class 'torch.nn.modules.activation.ELU'>,128,100000,0.0001,0.99,1.7829447669828584e-05,10000,-3.5977381104893436,big,0.01,16,PRUNED
74,74,425.08258056640625,2022-11-16 02:02:47.659114,2022-11-16 03:31:01.153626,0 days 01:28:13.494512,<class 'torch.nn.modules.activation.ELU'>,16,100000,0.0001,0.995,6.598409447107476e-05,10000,-2.9125674722436377,big,0.01,512,COMPLETE
75,75,-315.12188720703125,2022-11-16 03:31:01.153626,2022-11-16 03:45:33.265885,0 days 00:14:32.112259,<class 'torch.nn.modules.activation.ELU'>,64,10000,0.5,0.99,0.0001311692639819811,10000,-0.06616094082231644,medium,0.005,4,PRUNED
76,76,-1486.8731689453125,2022-11-16 03:45:33.267934,2022-11-16 04:18:10.572868,0 days 00:32:37.304934,<class 'torch.nn.modules.activation.Tanh'>,2048,100000,0.0001,0.98,0.982521529237572,1000,-1.2309674969983788,big,0.08,1,PRUNED
77,77,-103.81000518798828,2022-11-16 04:18:10.574900,2022-11-16 04:32:23.288691,0 days 00:14:12.713791,<class 'torch.nn.modules.activation.ReLU'>,128,10000,auto,0.999,0.001736114521574324,20000,-0.5250222363900212,medium,0.05,16,PRUNED
78,78,-4095.18408203125,2022-11-16 04:32:23.296751,2022-11-16 04:46:58.701262,0 days 00:14:35.404511,<class 'torch.nn.modules.activation.Tanh'>,64,1000000,0.1,0.9,0.0009892696966683327,1000,0.42694225660957175,medium,0.001,8,PRUNED
79,79,-2825.135009765625,2022-11-16 04:46:58.701262,2022-11-16 05:01:32.174574,0 days 00:14:33.473312,<class 'torch.nn.modules.activation.ReLU'>,16,10000,0.0001,0.9999,0.10683108840964937,10000,0.7970338857125265,medium,0.01,4,PRUNED
80,80,1137.748291015625,2022-11-16 05:01:32.174574,2022-11-16 05:31:27.240160,0 days 00:29:55.065586,<class 'torch.nn.modules.activation.LeakyReLU'>,1024,10000,0.5,0.995,5.539044415983091e-05,20000,-2.2606885115674986,small,0.08,512,PRUNED
81,81,-2937.390625,2022-11-16 05:31:27.240160,2022-11-16 05:45:47.440227,0 days 00:14:20.200067,<class 'torch.nn.modules.activation.ELU'>,16,100000,0.0001,0.995,5.985731089282859e-05,10000,-2.8572541169226504,big,0.01,512,PRUNED
82,82,2077.42822265625,2022-11-16 05:45:47.440227,2022-11-16 06:00:06.230474,0 days 00:14:18.790247,<class 'torch.nn.modules.activation.ELU'>,16,100000,0.0001,0.995,2.530155735609993e-05,10000,-3.0294219463450225,big,0.01,512,PRUNED
83,83,-3480.33642578125,2022-11-16 06:00:06.230474,2022-11-16 06:14:34.308091,0 days 00:14:28.077617,<class 'torch.nn.modules.activation.ELU'>,16,100000,0.0001,0.995,0.0002385748089644318,10000,-3.690934987011573,big,0.01,512,PRUNED
84,84,-2465.67333984375,2022-11-16 06:14:34.310122,2022-11-16 06:28:47.352631,0 days 00:14:13.042509,<class 'torch.nn.modules.activation.ELU'>,16,100000,0.0001,0.995,0.0005413299421785525,10000,-3.1545316401094623,big,0.01,512,PRUNED
85,85,507.8648681640625,2022-11-16 06:28:47.354667,2022-11-16 06:56:58.040024,0 days 00:28:10.685357,<class 'torch.nn.modules.activation.ELU'>,512,100000,0.0001,0.95,0.032723110303524774,10000,-2.4795495380164665,big,0.01,16,PRUNED
86,86,-1879.1875,2022-11-16 06:56:58.048065,2022-11-16 07:14:45.545750,0 days 00:17:47.497685,<class 'torch.nn.modules.activation.ReLU'>,256,1000000,0.01,0.9,0.6030143022621768,0,0.5913699780260613,big,0.05,64,PRUNED
87,87,-3225.03955078125,2022-11-16 07:14:45.545750,2022-11-16 07:29:04.478781,0 days 00:14:18.933031,<class 'torch.nn.modules.activation.Tanh'>,32,100000,0.0001,0.999,0.0001517604047183936,1000,-2.6981769071332735,medium,0.02,256,PRUNED
88,88,766.8837890625,2022-11-16 07:29:04.480821,2022-11-16 08:11:56.179526,0 days 00:42:51.698705,<class 'torch.nn.modules.activation.ELU'>,2048,1000000,0.05,0.99,0.0176135507420601,10000,0.24890066597419147,medium,0.08,32,PRUNED
89,89,-6234.8056640625,2022-11-16 08:11:56.179565,2022-11-16 08:26:09.736677,0 days 00:14:13.557112,<class 'torch.nn.modules.activation.LeakyReLU'>,64,10000,0.0001,0.9999,5.691249858370113e-05,20000,0.059625072995681094,big,0.001,4,PRUNED
90,90,2093.60546875,2022-11-16 08:26:09.736677,2022-11-16 08:40:48.916406,0 days 00:14:39.179729,<class 'torch.nn.modules.activation.ReLU'>,128,1000000,0.5,0.995,0.00972487273337477,10000,-0.23964410795946445,medium,0.01,512,PRUNED
