,number,value,datetime_start,datetime_complete,duration,params_activation_fn,params_batch_size,params_clip_range,params_ent_coef,params_gae_lambda,params_gamma,params_learning_rate,params_log_std_init,params_max_grad_norm,params_n_epochs,params_n_steps,params_net_arch,params_ortho_init,params_sde_sample_freq,params_vf_coef,state
90,90,-320.76153564453125,2022-10-22 01:39:20.965360,2022-10-22 01:53:05.386301,0 days 00:13:44.420941,tanh,512,0.2,0.007797452477347138,0.8,0.9,0.08037657610892153,0.5937752588107159,0.3,5,32,big,True,256,0.09730824369435415,PRUNED
91,91,-8290.400390625,2022-10-22 01:53:05.386301,2022-10-22 02:07:00.321955,0 days 00:13:54.935654,elu,32,0.2,0.031063503441623504,0.99,0.9,0.0063344495496144,0.11641944511593848,0.3,5,32,medium,False,256,0.6636588677387029,PRUNED
92,92,-9627.037109375,2022-10-22 02:07:00.321955,2022-10-22 02:20:58.756250,0 days 00:13:58.434295,elu,32,0.2,0.01401157654637985,0.99,0.9,0.008741125208807975,0.5113498398462456,0.3,5,32,medium,False,256,0.6168770260590365,PRUNED
93,93,-2270.497802734375,2022-10-22 02:20:58.756250,2022-10-22 02:35:11.338937,0 days 00:14:12.582687,elu,32,0.2,0.044026011250162506,0.99,0.9,0.01323874231477759,-0.34925347709090115,0.3,5,32,medium,False,256,0.777593715116269,PRUNED
94,94,35.37626647949219,2022-10-22 02:35:11.338937,2022-10-22 02:48:49.736263,0 days 00:13:38.397326,elu,32,0.2,0.019367186600106986,0.99,0.9,0.022972060996968753,-0.09925353787299096,0.3,5,2048,medium,False,256,0.7381641512687883,PRUNED
95,95,350.29547119140625,2022-10-22 02:48:49.744311,2022-10-22 03:05:52.601011,0 days 00:17:02.856700,elu,16,0.4,0.029589289205026,1.0,0.999,4.3272237483214885e-05,0.3775879141173239,0.9,20,16,medium,False,64,0.812731936638774,PRUNED
96,96,735.6616821289062,2022-10-22 03:05:52.601011,2022-10-22 03:19:29.537223,0 days 00:13:36.936212,relu,32,0.3,0.0036910136387188243,0.92,0.9,0.004206841788718217,0.2082502223976463,2.0,5,32,small,False,256,0.5120505717299919,PRUNED
97,97,-2408.69970703125,2022-10-22 03:19:29.537223,2022-10-22 03:33:13.018838,0 days 00:13:43.481615,elu,256,0.1,0.09845021200526842,0.99,0.9999,0.0018479289147676826,0.10893539596294562,0.6,1,8,big,False,16,0.5565816755645779,PRUNED
98,98,239.4761505126953,2022-10-22 03:33:13.018838,2022-10-22 03:49:33.549435,0 days 00:16:20.530597,elu,16,0.3,0.06215174589773161,1.0,0.9,0.037716645758937004,0.6810237849220226,0.7,10,16,medium,True,256,0.7194076573079646,PRUNED
99,99,-4300.58349609375,2022-10-22 03:49:33.557481,2022-10-22 04:07:16.060463,0 days 00:17:42.502982,tanh,32,0.2,7.4398511102546024e-06,0.92,0.995,0.002605930422727486,-1.1742026981690525,2.0,20,512,big,False,8,0.43585904774371076,PRUNED
