,number,value,datetime_start,datetime_complete,duration,params_activation_fn,params_batch_size,params_buffer_size,params_gamma,params_learning_rate,params_net_arch,params_noise_std,params_noise_type,params_tau,params_train_freq,state
90,90,3258.57763671875,2022-11-13 13:46:33.928424,2022-11-13 14:02:33.296329,0 days 00:15:59.367905,<class 'torch.nn.modules.activation.LeakyReLU'>,512,100000,0.98,0.0024915611850292937,medium,0.0729658016569471,normal,0.08,256,PRUNED
91,91,-4228.400390625,2022-11-13 14:02:33.296329,2022-11-13 14:24:28.595225,0 days 00:21:55.298896,<class 'torch.nn.modules.activation.ELU'>,1024,100000,0.99,0.00351926958358035,medium,0.07480557025425788,ornstein-uhlenbeck,0.05,4,PRUNED
92,92,3948.615234375,2022-11-13 14:24:28.595225,2022-11-13 17:03:43.154733,0 days 02:39:14.559508,<class 'torch.nn.modules.activation.ELU'>,1024,100000,0.99,0.0047088281225236665,medium,0.09572163484125373,,0.05,4,COMPLETE
93,93,778.6875,2022-11-13 17:03:43.154733,2022-11-13 17:22:43.652717,0 days 00:19:00.497984,<class 'torch.nn.modules.activation.LeakyReLU'>,1024,100000,0.99,0.00797093834154535,medium,0.10489931188055729,,0.05,4,PRUNED
94,94,781.542236328125,2022-11-13 17:22:43.652717,2022-11-13 17:37:29.654838,0 days 00:14:46.002121,<class 'torch.nn.modules.activation.ELU'>,100,100000,0.9,0.0013160078589788844,medium,0.1516747103101273,,0.001,4,PRUNED
95,95,1204.508544921875,2022-11-13 17:37:29.662884,2022-11-13 17:55:40.563230,0 days 00:18:10.900346,<class 'torch.nn.modules.activation.Tanh'>,1024,100000,0.95,0.00016520863549518048,medium,0.3810595897236018,,0.05,1,PRUNED
96,96,489.6488037109375,2022-11-13 17:55:40.571283,2022-11-13 18:29:40.848159,0 days 00:34:00.276876,<class 'torch.nn.modules.activation.ELU'>,2048,100000,0.99,0.013346418387737022,medium,0.015875683617802255,normal,0.05,4,PRUNED
97,97,-2341.64111328125,2022-11-13 18:29:40.856197,2022-11-13 18:55:52.296921,0 days 00:26:11.440724,<class 'torch.nn.modules.activation.ELU'>,1024,10000,0.99,0.00027718604559347465,big,0.05551660593954112,,0.005,4,PRUNED
98,98,759.9150390625,2022-11-13 18:55:52.296921,2022-11-13 19:14:50.606219,0 days 00:18:58.309298,<class 'torch.nn.modules.activation.LeakyReLU'>,1024,100000,0.9999,0.004053900346926318,medium,0.0005278912364040599,,0.02,64,PRUNED
99,99,2785.970947265625,2022-11-13 19:14:50.614291,2022-11-13 19:29:22.223772,0 days 00:14:31.609481,<class 'torch.nn.modules.activation.ELU'>,32,100000,0.95,0.005726436601523903,medium,0.19395849892829803,,0.05,4,PRUNED
