,number,value,datetime_start,datetime_complete,duration,params_activation_fn,params_batch_size,params_clip_range,params_ent_coef,params_gae_lambda,params_gamma,params_learning_rate,params_log_std_init,params_max_grad_norm,params_n_epochs,params_n_steps,params_net_arch,params_ortho_init,params_sde_sample_freq,params_vf_coef,state
0,0,-244.9337615966797,2022-10-19 12:25:58.401125,2022-10-19 14:00:23.951727,0 days 01:34:25.550602,relu,256,0.4,0.00023178536156933454,1.0,0.9,1.9587139274255435e-05,-2.099667395001986,0.9,20,16,small,False,256,0.14161410795341534,COMPLETE
1,1,2049.16259765625,2022-10-19 14:00:23.951727,2022-10-19 15:26:56.830517,0 days 01:26:32.878790,tanh,64,0.1,0.001163508057781369,0.92,0.999,0.005469059964990472,-1.246702671714218,1.0,10,16,small,True,64,0.5545749717657282,COMPLETE
2,2,3767.7109375,2022-10-19 15:26:56.832556,2022-10-19 16:57:12.924298,0 days 01:30:16.091742,tanh,16,0.2,0.02245488795533004,0.92,0.995,0.0013647642264479798,-2.1431516823112435,2.0,5,8,medium,False,64,0.3914336836587027,COMPLETE
3,3,-9478.7900390625,2022-10-19 16:57:12.924298,2022-10-19 18:23:56.190688,0 days 01:26:43.266390,elu,8,0.2,1.3542723997640085e-07,0.99,0.98,0.023325539737517192,-2.6531088067394113,0.7,1,16,big,False,32,0.08775342335876779,COMPLETE
4,4,-1157.78857421875,2022-10-19 18:23:56.190688,2022-10-19 19:51:20.536867,0 days 01:27:24.346179,tanh,16,0.1,4.419519955668601e-05,0.95,0.9999,0.0057383988565353275,-0.42650464346795314,0.6,10,512,small,False,8,0.24180343185621023,COMPLETE
5,5,306.9299621582031,2022-10-19 19:51:20.538905,2022-10-19 21:21:33.152377,0 days 01:30:12.613472,leaky_relu,128,0.3,0.04756757017634129,0.92,0.995,0.6406459805787815,0.6041005790952632,2.0,5,8,medium,True,64,0.9998447480075017,COMPLETE
6,6,-878.6309814453125,2022-10-19 21:21:33.162439,2022-10-19 21:51:43.529379,0 days 00:30:10.366940,tanh,16,0.2,0.03581594524670479,0.9,0.99,6.446751384899653e-05,-3.9066864524177243,2.0,5,8,medium,False,16,0.5557594847551479,PRUNED
7,7,-727.24853515625,2022-10-19 21:51:43.529379,2022-10-19 22:26:06.471122,0 days 00:34:22.941743,leaky_relu,512,0.2,2.516677616927795e-07,0.98,0.95,0.00028857388319874144,-3.176154471881066,0.3,5,32,medium,False,-1,0.8762266772366623,PRUNED
8,8,-695.975341796875,2022-10-19 22:26:06.473164,2022-10-19 22:52:50.688746,0 days 00:26:44.215582,elu,32,0.4,2.790310577668203e-06,0.8,0.995,0.000521805824082593,-1.2568391687064824,0.5,1,1024,big,True,128,0.4122531759420288,PRUNED
9,9,,2022-10-19 22:52:50.688746,2022-10-19 22:54:53.448997,0 days 00:02:02.760251,relu,16,0.3,0.002034815644975641,0.92,0.995,0.08047199603417429,-0.12658857179215,5.0,20,256,medium,False,64,0.7112045673517474,PRUNED
10,10,-1519.49169921875,2022-10-19 22:54:53.448997,2022-10-19 23:25:01.187517,0 days 00:30:07.738520,tanh,8,0.2,6.311298833648729e-06,0.9,0.95,0.0004873588860322068,-1.8733229963658042,0.8,5,64,medium,True,8,0.3643505832925505,PRUNED
11,11,2371.123291015625,2022-10-19 23:25:01.187517,2022-10-20 00:46:26.075347,0 days 01:21:24.887830,tanh,64,0.1,0.001692730728095064,0.92,0.999,0.0038956365321833352,-1.0109413942025753,1.0,10,128,small,True,64,0.5855119232910801,COMPLETE
12,12,-631.372802734375,2022-10-20 00:46:26.077383,2022-10-20 01:13:30.834001,0 days 00:27:04.756618,tanh,64,0.1,0.006899700186192186,0.92,0.999,0.0014896276998972295,-0.6626510037083209,1.0,10,128,small,True,64,0.6597758486977315,PRUNED
13,13,308.4162902832031,2022-10-20 01:13:30.836039,2022-10-20 02:35:42.873739,0 days 01:22:12.037700,tanh,64,0.1,0.08245976436894879,0.92,0.999,0.038113565132752124,-2.5732006355068555,1.0,10,128,small,True,64,0.28926876604653057,COMPLETE
14,14,-414.5511169433594,2022-10-20 02:35:42.873739,2022-10-20 02:55:50.241884,0 days 00:20:07.368145,tanh,512,0.2,0.00015947113607417065,0.8,0.99,0.00012846121754003122,0.8821515772101307,2.0,5,2048,big,False,128,0.721582108104813,PRUNED
15,15,-4930.9140625,2022-10-20 02:55:50.243919,2022-10-20 03:13:15.864760,0 days 00:17:25.620841,tanh,32,0.1,0.0073149629530673095,1.0,0.9999,0.001648928718024122,-0.988653099110867,0.8,10,8,medium,True,32,0.4568747085049576,PRUNED
16,16,1214.88623046875,2022-10-20 03:13:15.864760,2022-10-20 04:32:45.432259,0 days 01:19:29.567499,relu,128,0.4,0.0006547893822539751,0.99,0.98,0.010655390250257163,-0.003855725274365618,0.9,1,128,small,False,256,0.5988759316797239,COMPLETE
17,17,,2022-10-20 04:32:45.432259,2022-10-20 04:38:04.991383,0 days 00:05:19.559124,elu,256,0.3,0.008922094399384661,0.95,0.9,0.24236359007283223,-1.5886951563554783,0.7,20,64,medium,True,-1,0.01116730110140901,PRUNED
18,18,-509.20849609375,2022-10-20 04:38:04.993423,2022-10-20 04:58:52.086173,0 days 00:20:47.092750,leaky_relu,16,0.2,1.9266596935362688e-08,0.98,0.995,0.0015446972186266856,-2.3178262973722754,0.3,5,512,small,False,16,0.8356418347803432,PRUNED
19,19,-717.39501953125,2022-10-20 04:58:52.088207,2022-10-20 05:12:36.410494,0 days 00:13:44.322287,tanh,64,0.1,9.985879166899448e-06,0.92,0.999,1.3400738359687695e-05,-3.2222074538573464,0.5,10,256,big,True,64,0.2969940640461751,PRUNED
20,20,-553.7640380859375,2022-10-20 05:12:36.410494,2022-10-20 05:33:34.718815,0 days 00:20:58.308321,tanh,64,0.1,7.878198548569604e-05,0.92,0.995,0.014178442446494733,-1.7594078573944876,5.0,5,32,medium,False,64,0.4638510504394956,PRUNED
21,21,-367.47662353515625,2022-10-20 05:33:34.718815,2022-10-20 07:00:44.214039,0 days 01:27:09.495224,tanh,64,0.1,0.0010617607385604167,0.92,0.999,0.006781817363659566,-1.063489176215157,1.0,10,16,small,True,64,0.5847704796193495,COMPLETE
22,22,-1346.2568359375,2022-10-20 07:00:44.222087,2022-10-20 07:20:57.984448,0 days 00:20:13.762361,tanh,64,0.1,0.0023252432712226124,0.92,0.999,0.002603323645134974,-1.4587746589010055,1.0,10,1024,small,True,64,0.5246798280560503,PRUNED
23,23,-696.929931640625,2022-10-20 07:20:57.984448,2022-10-20 07:27:50.238785,0 days 00:06:52.254337,tanh,64,0.1,0.015229563951684535,0.92,0.999,0.07399928290295042,-0.8861009471214825,1.0,10,2048,small,True,64,0.36691639225923334,PRUNED
24,24,3648.26611328125,2022-10-20 07:27:50.254411,2022-10-20 08:54:45.691947,0 days 01:26:55.437536,tanh,16,0.1,0.0005228111723381498,0.92,0.999,0.003912282319947503,0.218103562107403,0.6,10,16,small,True,64,0.668981745045462,COMPLETE
25,25,1554.9755859375,2022-10-20 08:54:45.691947,2022-10-20 10:21:42.449694,0 days 01:26:56.757747,tanh,16,0.2,0.00037922346103298163,0.92,0.999,0.00075385395275379,0.36762320864380166,0.6,10,128,small,True,64,0.7993185162866165,COMPLETE
26,26,-536.95068359375,2022-10-20 10:21:42.449694,2022-10-20 10:35:51.123730,0 days 00:14:08.674036,relu,16,0.4,0.0033079088476456048,0.98,0.99,0.0001902334604003466,-0.4096114534068036,0.6,1,8,small,True,32,0.6801240048746053,PRUNED
27,27,3098.41162109375,2022-10-20 10:35:51.123730,2022-10-20 12:49:58.456654,0 days 02:14:07.332924,elu,16,0.3,0.02747573619430979,1.0,0.9999,7.930727846187407e-05,0.3321352065652965,2.0,20,8,big,True,16,0.772033033190244,COMPLETE
28,28,214.9152069091797,2022-10-20 12:49:58.458685,2022-10-20 13:23:10.956348,0 days 00:33:12.497663,elu,16,0.3,0.022687798509531086,1.0,0.9999,4.4301527772832336e-05,0.32348374112131567,2.0,20,8,big,False,16,0.9423679270794947,PRUNED
29,29,3407.0791015625,2022-10-20 13:23:10.956348,2022-10-20 15:12:45.450458,0 days 01:49:34.494110,elu,256,0.3,0.0001822826411586212,1.0,0.9,3.619972056278042e-05,0.9257303325663114,2.0,20,16,big,False,256,0.7744300567304568,COMPLETE
30,30,833.6954345703125,2022-10-20 15:12:45.458500,2022-10-20 15:39:53.541925,0 days 00:27:08.083425,elu,256,0.3,0.00016881769956805115,1.0,0.9,2.2986569477282926e-05,0.8049905998637852,0.9,20,16,big,False,256,0.17073869689995566,PRUNED
31,31,3546.353759765625,2022-10-20 15:39:53.541925,2022-10-20 17:28:37.074477,0 days 01:48:43.532552,elu,256,0.3,0.09564652704527404,1.0,0.9,8.043558146035907e-05,0.2176495856162118,2.0,20,16,big,False,256,0.764493684473273,COMPLETE
32,32,826.3343505859375,2022-10-20 17:28:37.074477,2022-10-20 17:55:47.325280,0 days 00:27:10.250803,elu,256,0.3,0.08613357952874895,1.0,0.9,3.418562140171106e-05,-0.04290713210448441,2.0,20,16,big,False,256,0.9020644139037728,PRUNED
33,33,1047.757568359375,2022-10-20 17:55:47.325280,2022-10-20 18:22:53.395888,0 days 00:27:06.070608,elu,256,0.3,2.1155149896711254e-05,1.0,0.9,0.00013064478303671716,0.5823772420430391,2.0,20,16,big,False,256,0.7668225200244869,PRUNED
34,34,-651.5271606445312,2022-10-20 18:22:53.395888,2022-10-20 18:41:11.192104,0 days 00:18:17.796216,elu,256,0.3,1.010404766496173e-06,1.0,0.9,1.3774603327474008e-05,-2.120977084188665,0.6,20,16,big,False,256,0.6392254810966341,PRUNED
35,35,-232.60679626464844,2022-10-20 18:41:11.192104,2022-10-20 18:59:57.695075,0 days 00:18:46.502971,elu,256,0.3,0.0004096754209948828,0.99,0.9,0.0008198206766625982,0.9821840526752098,2.0,20,16,big,False,256,0.8353295156697758,PRUNED
36,36,329.7848815917969,2022-10-20 18:59:57.695075,2022-10-20 19:32:41.324347,0 days 00:32:43.629272,leaky_relu,8,0.2,5.123260430240505e-05,0.95,0.98,1.0047834778895288e-05,-0.3956098211972773,2.0,20,16,big,False,8,0.7346134584816243,PRUNED
37,37,775.4190673828125,2022-10-20 19:32:41.332396,2022-10-20 19:54:08.492963,0 days 00:21:27.160567,elu,256,0.3,0.0038934522531452642,0.9,0.9,0.0002909966110938725,0.1469818168335646,0.7,5,16,medium,False,256,0.9680673482264068,PRUNED
38,38,-525.1461181640625,2022-10-20 19:54:08.492963,2022-10-20 20:07:27.158596,0 days 00:13:18.665633,relu,128,0.4,0.041301426389039636,0.8,0.95,7.666372102803343e-05,0.5123613779562728,0.6,1,512,big,False,-1,0.4852026461730076,PRUNED
39,39,-715.0438232421875,2022-10-20 20:07:27.160633,2022-10-20 20:24:38.214212,0 days 00:17:11.053579,leaky_relu,512,0.2,1.760725520414376e-05,1.0,0.995,4.183135170108674e-05,-3.231873811980596,2.0,20,16,medium,False,128,0.8823032936454656,PRUNED
40,40,3594.203369140625,2022-10-20 20:24:38.214212,2022-10-20 21:53:15.835202,0 days 01:28:37.620990,elu,32,0.3,0.017645121179612862,0.99,0.9,0.028086020332699673,0.7587334716096195,0.3,5,32,big,False,256,0.6208851730401921,COMPLETE
41,41,3759.97314453125,2022-10-20 21:53:15.843246,2022-10-20 23:20:18.198151,0 days 01:27:02.354905,elu,32,0.3,0.012527984535346096,0.99,0.9,0.02517839788116508,0.7333944219104371,0.3,5,32,big,False,256,0.6163968782720354,COMPLETE
42,42,-139.3980255126953,2022-10-20 23:20:18.206196,2022-10-20 23:34:48.299756,0 days 00:14:30.093560,elu,32,0.3,0.01839007601846254,0.99,0.9,0.031010978389671134,-0.25355171498122586,0.3,5,32,big,False,256,0.6188751523659426,PRUNED
43,43,266.3077087402344,2022-10-20 23:34:48.307808,2022-10-20 23:49:59.541313,0 days 00:15:11.233505,elu,32,0.3,0.09952967349710155,0.99,0.9,0.13595118301736245,0.6788862037893811,0.3,5,32,big,False,256,0.5371345184358369,PRUNED
44,44,-2566.68896484375,2022-10-20 23:49:59.541313,2022-10-21 00:04:29.350825,0 days 00:14:29.809512,elu,32,0.3,0.012152420727974426,0.99,0.995,0.01758468969412971,-0.6518038414233303,0.3,5,32,big,False,8,0.40889946480665607,PRUNED
45,45,2725.50341796875,2022-10-21 00:04:29.352862,2022-10-21 01:29:31.998537,0 days 01:25:02.645675,elu,32,0.2,0.040684260001505476,0.99,0.9,0.007759743019237097,0.1286482411543628,0.3,5,32,medium,False,256,0.6573548411837968,COMPLETE
46,46,-1551.40869140625,2022-10-21 01:29:32.006577,2022-10-21 03:00:54.000544,0 days 01:31:21.993967,elu,32,0.3,0.004857030798458411,0.99,0.95,0.059958326973584816,-2.9648232521636046,0.3,5,32,big,False,32,0.6963198503935449,PRUNED
47,47,,2022-10-21 03:00:54.000544,2022-10-21 03:04:02.335944,0 days 00:03:08.335400,relu,16,0.4,0.0011560432807410552,0.9,0.995,0.7548187439277168,0.6616373504631028,0.8,5,1024,medium,False,128,0.5599696460118371,PRUNED
48,48,-1368.9259033203125,2022-10-21 03:04:02.335944,2022-10-21 03:18:01.281209,0 days 00:13:58.945265,tanh,32,0.2,0.043680993286742624,0.99,0.98,0.0039815072097666784,0.4643887453090369,0.5,5,64,big,False,-1,0.4054230188044864,PRUNED
49,49,-366.52813720703125,2022-10-21 03:18:01.281209,2022-10-21 03:32:59.340387,0 days 00:14:58.059178,leaky_relu,8,0.3,0.009786848395825063,0.95,0.99,0.2925004926764161,0.16376407236718254,5.0,5,32,medium,False,256,0.2189079690602735,PRUNED
50,50,2610.953125,2022-10-21 03:32:59.340387,2022-10-21 04:59:36.461235,0 days 01:26:37.120848,tanh,16,0.1,0.004745755517202541,0.8,0.9,0.025138413801312855,-2.4900146254044353,0.3,5,256,big,False,64,0.5109219613587769,COMPLETE
51,51,-461.9903564453125,2022-10-21 04:59:36.463267,2022-10-21 05:13:25.009076,0 days 00:13:48.545809,elu,256,0.3,0.018769612882639147,0.98,0.9,0.00031098343999445865,0.8620955050381455,2.0,20,2048,big,False,256,0.7273906461187573,PRUNED
52,52,408.36456298828125,2022-10-21 05:13:25.011124,2022-10-21 05:48:02.971049,0 days 00:34:37.959925,elu,128,0.3,0.00029119583021304084,1.0,0.9,0.0021201891255219173,0.9830576140705496,0.6,1,8,big,False,256,0.8188521944111785,PRUNED
53,53,-7090.7763671875,2022-10-21 05:48:02.971049,2022-10-21 07:23:45.156136,0 days 01:35:42.185087,elu,512,0.3,8.798473094069709e-05,0.99,0.9,0.010170597050346208,0.7328223189392085,0.9,5,16,big,False,256,0.7585148603028324,COMPLETE
54,54,-2237.8935546875,2022-10-21 07:23:45.164172,2022-10-21 07:39:39.508971,0 days 00:15:54.344799,elu,32,0.3,0.0006878352810923076,0.92,0.9,0.05084356146833744,-2.0558705991351953,2.0,10,512,big,False,256,0.6086071811867959,PRUNED
55,55,-228.73110961914062,2022-10-21 07:39:39.508971,2022-10-21 07:53:51.462475,0 days 00:14:11.953504,elu,16,0.3,0.0019727676223767025,0.92,0.995,0.005121916249430744,-0.2009410914459493,0.7,5,32,small,False,64,0.6805489288611567,PRUNED
56,56,256.4991760253906,2022-10-21 07:53:51.462475,2022-10-21 08:08:32.597566,0 days 00:14:41.135091,tanh,256,0.2,0.006995587725525408,1.0,0.9,0.12437298194891014,0.2654075420424765,0.3,20,64,big,False,8,0.2892329473937668,PRUNED
57,57,120.24022674560547,2022-10-21 08:08:32.599607,2022-10-21 09:35:30.141063,0 days 01:26:57.541456,tanh,32,0.1,0.06537632947862805,0.9,0.999,0.0010093663160411946,0.46062115698327694,0.8,10,16,small,True,256,0.5727089385286976,COMPLETE
58,58,-465.26165771484375,2022-10-21 09:35:30.141063,2022-10-21 09:49:45.907529,0 days 00:14:15.766466,elu,16,0.3,3.3764992736958765e-06,0.92,0.95,0.0004587280022366738,-2.920702986017459,0.5,5,256,medium,False,64,0.6267105614747676,PRUNED
59,59,-11038.931640625,2022-10-21 09:49:45.915569,2022-10-21 10:03:13.388133,0 days 00:13:27.472564,relu,256,0.4,0.00012256847419180554,0.99,0.9999,0.019856757674223152,-1.3329282619895424,2.0,1,8,small,True,32,0.45073324915618906,PRUNED
60,60,-601.60595703125,2022-10-21 10:03:13.388133,2022-10-21 10:19:29.160414,0 days 00:16:15.772281,tanh,8,0.1,0.0007106387744590528,0.98,0.99,0.00012795413780384348,-0.0054047713147390986,5.0,10,1024,big,False,16,0.7058921039865063,PRUNED
61,61,522.4550170898438,2022-10-21 10:19:29.160414,2022-10-21 10:41:23.704000,0 days 00:21:54.543586,elu,16,0.3,0.027239378914375206,1.0,0.9999,6.185846167702131e-05,0.7317112618315752,2.0,20,8,big,True,16,0.7612203433229517,PRUNED
62,62,596.31982421875,2022-10-21 10:41:23.712047,2022-10-21 11:03:28.500830,0 days 00:22:04.788783,elu,16,0.3,0.029955746233208572,1.0,0.9999,0.00015099228436150694,0.34889998294109564,2.0,20,8,big,True,16,0.7954792995728694,PRUNED
63,63,2669.05078125,2022-10-21 11:03:28.500830,2022-10-21 13:16:30.078689,0 days 02:13:01.577859,elu,16,0.3,0.013311935774764513,1.0,0.9999,7.47289133504749e-05,0.5642452661016694,2.0,20,8,big,True,16,0.8504080475513882,COMPLETE
64,64,-717.4063110351562,2022-10-21 13:16:30.078689,2022-10-21 13:38:52.462455,0 days 00:22:22.383766,elu,16,0.3,0.07253854484349982,1.0,0.9999,3.0075845660952417e-05,-3.8217419052753376,0.6,20,8,big,True,16,0.7869785714078144,PRUNED
65,65,-447.0882263183594,2022-10-21 13:38:52.462455,2022-10-21 13:54:46.542694,0 days 00:15:54.080239,elu,16,0.3,0.05340125759011548,0.92,0.999,2.1757976254360093e-05,0.8265474973198457,2.0,20,2048,big,True,64,0.7287661625427972,PRUNED
66,66,459.66766357421875,2022-10-21 13:54:46.542694,2022-10-21 14:37:01.719558,0 days 00:42:15.176864,tanh,32,0.2,2.6853599550141214e-08,0.95,0.98,0.010413072038809191,0.20685600546147487,2.0,20,16,medium,True,256,0.642864059163641,PRUNED
67,67,483.8193359375,2022-10-21 14:37:01.719558,2022-10-21 14:50:21.846556,0 days 00:13:20.126998,elu,128,0.3,0.002538161923557473,1.0,0.9,0.00021518197891714434,0.43360668719618195,0.3,5,128,small,True,128,0.6724554519331696,PRUNED
68,68,-30.1048526763916,2022-10-21 14:50:21.854630,2022-10-21 15:04:51.621313,0 days 00:14:29.766683,leaky_relu,256,0.1,0.024343803358328794,0.92,0.995,9.714399751523787e-05,0.051152000520685914,0.9,10,32,big,False,-1,0.9232819468241763,PRUNED
69,69,82.31747436523438,2022-10-21 15:04:51.629355,2022-10-21 15:28:28.057435,0 days 00:23:36.428080,elu,512,0.3,0.006309184187276896,0.8,0.9,0.03757478117997384,-0.6245346522748382,2.0,20,16,big,False,64,0.7575242974484541,PRUNED
70,70,2488.66259765625,2022-10-21 15:28:28.059474,2022-10-21 16:55:24.518807,0 days 01:26:56.459333,tanh,16,0.2,4.2988210507074956e-05,1.0,0.999,0.00340574284632391,0.892418494749816,0.6,5,8,small,True,256,0.37268879499940355,COMPLETE
71,71,3117.01416015625,2022-10-21 16:55:24.518807,2022-10-21 18:20:01.624300,0 days 01:24:37.105493,elu,32,0.2,0.03627946025112772,0.99,0.9,0.006373397984556454,-0.11807884770116822,0.3,5,32,medium,False,256,0.6522471518407043,COMPLETE
72,72,-504.38555908203125,2022-10-21 18:20:01.632387,2022-10-21 18:34:03.806898,0 days 00:14:02.174511,elu,32,0.2,0.012735320537948956,0.99,0.9,0.005374570252787653,-0.10015531864745719,0.3,5,32,medium,False,256,0.8650342442159443,PRUNED
73,73,160.05307006835938,2022-10-21 18:34:03.814944,2022-10-21 18:48:09.464170,0 days 00:14:05.649226,elu,32,0.2,0.09785708424882399,0.99,0.9,0.014126577879495773,-1.6813229812845267,0.3,5,32,medium,False,256,0.593289202973784,PRUNED
74,74,-1914.4508056640625,2022-10-21 18:48:09.464170,2022-10-21 19:02:00.339599,0 days 00:13:50.875429,elu,32,0.2,0.03688285509228545,0.99,0.9,0.0020706083170429963,0.308333480934119,0.7,5,32,medium,False,256,0.7036353315920336,PRUNED
75,75,290.20697021484375,2022-10-21 19:02:00.339599,2022-10-21 19:19:06.089555,0 days 00:17:05.749956,elu,256,0.2,0.05687898066157752,0.99,0.9,5.2731915724471654e-05,-0.29911844614423233,0.3,20,16,medium,False,256,0.6507135091233605,PRUNED
76,76,-352.65325927734375,2022-10-21 19:19:06.097609,2022-10-21 19:32:50.004324,0 days 00:13:43.906715,elu,32,0.3,0.01758259720082691,0.92,0.995,0.0010621010983480291,0.5884322915419513,2.0,5,32,medium,False,64,0.8215641693656759,PRUNED
77,77,285.2103271484375,2022-10-21 19:32:50.004324,2022-10-21 20:01:26.556190,0 days 00:28:36.551866,relu,16,0.4,0.009393708654984245,1.0,0.9999,0.008296092930327681,-0.5346832540165667,0.3,10,512,big,False,256,0.3284600989709974,PRUNED
78,78,-1028.47216796875,2022-10-21 20:01:26.556190,2022-10-21 20:14:49.452647,0 days 00:13:22.896457,tanh,256,0.1,0.0014083081438198866,0.99,0.9,0.014303705442636976,0.6707888364983758,1.0,1,16,big,False,32,0.48280377675708924,PRUNED
79,79,-320.4024963378906,2022-10-21 20:14:49.460686,2022-10-21 20:28:59.314648,0 days 00:14:09.853962,elu,32,0.3,0.02449825043001705,0.9,0.999,1.6495285222594702e-05,0.9674740304501427,0.5,5,64,medium,True,8,0.5539052031387428,PRUNED
80,80,-719.1754150390625,2022-10-21 20:28:59.314648,2022-10-21 20:43:16.043650,0 days 00:14:16.729002,leaky_relu,64,0.2,0.0032793507790249503,0.99,0.99,2.8281627134414887e-05,-1.9331979047705103,2.0,20,1024,big,False,16,0.7442706838452278,PRUNED
81,81,282.65704345703125,2022-10-21 20:43:16.043650,2022-10-21 20:57:19.078281,0 days 00:14:03.034631,elu,32,0.2,0.037296074108953366,0.99,0.9,0.004709935374411382,0.14639517868758278,0.3,5,32,medium,False,256,0.6714991516416994,PRUNED
82,82,-1777.44873046875,2022-10-21 20:57:19.078281,2022-10-21 21:11:15.279138,0 days 00:13:56.200857,elu,32,0.2,0.05033149749291079,0.99,0.9,0.007537433377198643,-0.8348969748213466,0.3,5,32,medium,False,256,0.7886618614655116,PRUNED
83,83,3487.97021484375,2022-10-21 21:11:15.279138,2022-10-21 22:35:43.202224,0 days 01:24:27.923086,elu,32,0.2,0.016555897655193358,0.99,0.9,0.02727621787989148,0.10501192861930418,0.3,5,32,medium,False,256,0.6499853706097342,COMPLETE
84,84,-6298.01318359375,2022-10-21 22:35:43.202224,2022-10-21 22:49:40.990295,0 days 00:13:57.788071,elu,32,0.2,0.010684250944971269,0.99,0.9,0.026805778842564257,-0.15373784731986517,0.3,5,32,medium,False,256,0.6130256723212009,PRUNED
85,85,318.8299255371094,2022-10-21 22:49:40.990295,2022-10-21 23:00:00.302873,0 days 00:10:19.312578,elu,8,0.3,0.005521548636789359,0.98,0.9,0.11605328645750208,0.4433286520705484,0.6,5,32,medium,False,256,0.6890513111758636,PRUNED
86,86,472.1961669921875,2022-10-21 23:00:00.302873,2022-10-21 23:13:27.722838,0 days 00:13:27.419965,elu,32,0.2,0.019690331008345024,0.95,0.95,0.05073000461214795,0.013450653105464616,0.8,5,256,small,False,64,0.5353300417315958,PRUNED
87,87,1681.895751953125,2022-10-21 23:13:27.722838,2022-10-22 01:02:03.725102,0 days 01:48:36.002264,tanh,16,0.1,0.00025868202456820445,0.92,0.98,0.0027434701814677506,0.7775781615153249,0.3,20,16,big,False,128,0.7118419072196153,PRUNED
88,88,-5075.564453125,2022-10-22 01:02:03.733140,2022-10-22 01:15:40.438443,0 days 00:13:36.705303,elu,128,0.3,0.0004324660204494,1.0,0.9,0.017859467004885866,-2.3008316210998783,5.0,5,128,medium,False,256,0.5873838576133471,PRUNED
89,89,45.574974060058594,2022-10-22 01:15:40.438443,2022-10-22 01:39:20.957297,0 days 00:23:40.518854,elu,256,0.3,0.07091525346305548,0.99,0.995,0.03117853529129722,0.31516209301926246,2.0,10,8,big,False,-1,0.6416495262834974,PRUNED
