,number,value,datetime_start,datetime_complete,duration,params_activation_fn,params_batch_size,params_buffer_size,params_ent_coef,params_gamma,params_learning_rate,params_learning_starts,params_log_std_init,params_net_arch,params_tau,params_train_freq,state
91,91,4064.7001953125,2022-11-16 08:40:48.916406,2022-11-16 10:11:26.415327,0 days 01:30:37.498921,<class 'torch.nn.modules.activation.ReLU'>,128,1000000,0.5,0.9,0.0007666348686557302,20000,-0.0887261756445652,medium,0.05,16,COMPLETE
92,92,-799.1390991210938,2022-11-16 10:11:26.415327,2022-11-16 11:41:35.957314,0 days 01:30:09.541987,<class 'torch.nn.modules.activation.ReLU'>,128,1000000,0.5,0.9,0.0004109814645485192,20000,-0.43440036445425184,medium,0.05,16,COMPLETE
93,93,1328.24658203125,2022-11-16 11:41:35.957314,2022-11-16 11:55:49.874706,0 days 00:14:13.917392,<class 'torch.nn.modules.activation.ReLU'>,128,1000000,0.5,0.9,0.0029971728653119625,20000,0.33757907065630355,medium,0.05,16,PRUNED
94,94,2849.42578125,2022-11-16 11:55:49.882774,2022-11-16 12:09:57.286789,0 days 00:14:07.404015,<class 'torch.nn.modules.activation.ReLU'>,128,1000000,0.5,0.9,0.0014455400604338265,20000,-0.11977142345722003,medium,0.05,16,PRUNED
95,95,1990.523681640625,2022-11-16 12:09:57.286844,2022-11-16 12:24:01.502465,0 days 00:14:04.215621,<class 'torch.nn.modules.activation.ReLU'>,16,1000000,0.0001,0.9,0.0011027755816416336,20000,-0.6508813898558721,medium,0.005,512,PRUNED
96,96,1048.243408203125,2022-11-16 12:24:01.510507,2022-11-16 12:40:25.333033,0 days 00:16:23.822526,<class 'torch.nn.modules.activation.Tanh'>,512,10000,0.5,0.95,0.0007198305113644039,1000,-2.9193027968370693,medium,0.05,128,PRUNED
97,97,2995.446044921875,2022-11-16 12:40:25.333033,2022-11-16 12:54:47.326968,0 days 00:14:21.993935,<class 'torch.nn.modules.activation.LeakyReLU'>,64,1000000,0.0001,0.999,0.003919174902105901,0,0.004875724559460032,small,0.08,1,PRUNED
98,98,424.5807800292969,2022-11-16 12:54:47.326998,2022-11-16 13:08:55.117431,0 days 00:14:07.790433,<class 'torch.nn.modules.activation.ReLU'>,128,10000,auto,0.98,0.006724452489374043,20000,-0.9373123081812712,medium,0.01,4,PRUNED
99,99,380.86273193359375,2022-11-16 13:08:55.117431,2022-11-16 13:23:34.212669,0 days 00:14:39.095238,<class 'torch.nn.modules.activation.Tanh'>,64,1000000,0.05,0.9,0.0027812452692362703,10000,0.1716433845590556,big,0.005,16,PRUNED
