,number,value,datetime_start,datetime_complete,duration,params_activation_fn,params_batch_size,params_clip_range,params_ent_coef,params_gae_lambda,params_gamma,params_learning_rate,params_log_std_init,params_max_grad_norm,params_n_epochs,params_n_steps,params_net_arch,params_ortho_init,params_sde_sample_freq,params_vf_coef,state
88,88,-445.9615173339844,2022-11-02 20:11:08.391317,2022-11-02 20:24:38.765617,0 days 00:13:30.374300,tanh,512,0.1,0.03845459187183949,0.8,0.99,0.0016284699660701022,-0.27720875344456564,0.3,5,512,small,False,16,0.8148015404851856,PRUNED
89,89,-282.3345031738281,2022-11-02 20:24:38.767657,2022-11-02 20:38:14.872448,0 days 00:13:36.104791,tanh,512,0.1,0.004895683583412221,0.8,0.99,0.000944711112183698,0.5490858380660852,0.3,5,256,small,False,16,0.8901549575911201,PRUNED
90,90,2199.53173828125,2022-11-02 20:38:14.880533,2022-11-02 22:06:44.830883,0 days 01:28:29.950350,tanh,512,0.1,0.016992788066491866,0.8,0.99,0.0010878144191203006,0.2797226918699578,0.3,5,8,small,False,16,0.92417825727518,COMPLETE
91,91,2156.00830078125,2022-11-02 22:06:44.838923,2022-11-02 23:34:47.984735,0 days 01:28:03.145812,tanh,512,0.1,0.01698396476354526,0.8,0.99,0.002247473466222085,0.40448397009584003,0.3,5,8,small,False,16,0.949944999768148,COMPLETE
92,92,2388.021484375,2022-11-02 23:34:47.984735,2022-11-03 01:03:08.782823,0 days 01:28:20.798088,tanh,512,0.1,0.015127598340012365,0.8,0.99,0.0022717939718598906,0.2732223419102527,0.3,5,8,small,False,16,0.936329901430659,COMPLETE
93,93,2367.66943359375,2022-11-03 01:03:08.782823,2022-11-03 02:31:56.139664,0 days 01:28:47.356841,tanh,512,0.1,0.018048965407122378,0.8,0.99,0.0011670039531394302,0.25959827141261776,0.3,5,8,small,False,16,0.9300691776266999,COMPLETE
94,94,2369.26123046875,2022-11-03 02:31:56.147703,2022-11-03 04:00:31.331634,0 days 01:28:35.183931,tanh,512,0.1,0.016933832865377873,0.8,0.99,0.0022362629484986097,0.2927057664843096,0.3,5,8,small,False,16,0.9325795373011904,COMPLETE
95,95,2409.3486328125,2022-11-03 04:00:31.339672,2022-11-03 05:28:45.027224,0 days 01:28:13.687552,tanh,512,0.1,0.0148345374655034,0.8,0.99,0.0022590528769936558,0.32225194410654034,0.3,5,8,small,False,16,0.9267123779700887,COMPLETE
96,96,2232.10888671875,2022-11-03 05:28:45.029257,2022-11-03 06:57:01.470349,0 days 01:28:16.441092,tanh,512,0.1,0.01758341248848585,0.8,0.99,0.0022409119571457237,0.2657574564053269,0.3,5,8,small,False,16,0.9355922113812672,COMPLETE
97,97,2350.17822265625,2022-11-03 06:57:01.472387,2022-11-03 08:26:12.985952,0 days 01:29:11.513565,tanh,512,0.1,0.02964165641654818,0.8,0.99,0.0017933793239015047,0.21248210107368182,0.3,5,8,small,False,16,0.9492752726089261,COMPLETE
98,98,2268.662109375,2022-11-03 08:26:12.985952,2022-11-03 10:00:54.835120,0 days 01:34:41.849168,tanh,512,0.1,0.033284923940456256,0.8,0.99,0.001734360756694129,0.6815833247381042,0.3,5,8,big,False,16,0.9932885913648251,COMPLETE
99,99,1719.373291015625,2022-11-03 10:00:54.835120,2022-11-03 11:34:59.573331,0 days 01:34:04.738211,tanh,512,0.1,0.030105969560106763,0.8,0.99,0.0016152427350300306,0.645861904099716,0.3,5,8,big,False,16,0.9950994207917986,COMPLETE
