,number,value,datetime_start,datetime_complete,duration,params_activation_fn,params_batch_size,params_buffer_size,params_ent_coef,params_gamma,params_learning_rate,params_learning_starts,params_log_std_init,params_net_arch,params_tau,params_train_freq,state
90,90,-6.852801322937012,2022-11-24 09:13:40.847143,2022-11-24 09:32:46.303943,0 days 00:19:05.456800,<class 'torch.nn.modules.activation.ReLU'>,1024,100000,0.0001,0.9999,0.001715587602701998,10000,-1.734879504628568,medium,0.001,128,PRUNED
91,91,-106.34506225585938,2022-11-24 09:32:46.311985,2022-11-24 09:52:00.935305,0 days 00:19:14.623320,<class 'torch.nn.modules.activation.ReLU'>,1024,100000,0.0001,0.9999,0.006802481481972355,10000,-1.3279837852067709,medium,0.001,128,PRUNED
92,92,125.93246459960938,2022-11-24 09:52:00.935305,2022-11-24 10:10:59.810222,0 days 00:18:58.874917,<class 'torch.nn.modules.activation.ReLU'>,1024,100000,0.0001,0.9999,0.0008565776175471581,10000,-1.9586378074512278,medium,0.001,128,PRUNED
93,93,1556.05615234375,2022-11-24 10:10:59.818262,2022-11-24 12:20:07.184224,0 days 02:09:07.365962,<class 'torch.nn.modules.activation.ReLU'>,1024,100000,0.0001,0.9999,0.0025046023164282806,10000,-1.6092249049052854,medium,0.001,128,COMPLETE
94,94,625.6940307617188,2022-11-24 12:20:07.192278,2022-11-24 12:39:05.191266,0 days 00:18:57.998988,<class 'torch.nn.modules.activation.ReLU'>,1024,100000,0.0001,0.9999,0.000384310634364524,10000,-1.5530390011392585,medium,0.001,128,PRUNED
95,95,-337.7486572265625,2022-11-24 12:39:05.191266,2022-11-24 12:58:08.285735,0 days 00:19:03.094469,<class 'torch.nn.modules.activation.ReLU'>,1024,100000,0.0001,0.9999,0.0014297351120257785,10000,-1.714231120613088,medium,0.001,128,PRUNED
96,96,1527.310546875,2022-11-24 12:58:08.287778,2022-11-24 15:29:32.147495,0 days 02:31:23.859717,<class 'torch.nn.modules.activation.ReLU'>,1024,100000,0.0001,0.9999,0.0005689336409573657,10000,-2.032865473650921,big,0.001,128,COMPLETE
97,97,1297.4241943359375,2022-11-24 15:29:32.147495,2022-11-24 17:59:40.146214,0 days 02:30:07.998719,<class 'torch.nn.modules.activation.ReLU'>,1024,100000,0.0001,0.9999,0.000600926350659294,10000,-1.5922551729535717,big,0.001,128,COMPLETE
98,98,-219.10797119140625,2022-11-24 17:59:40.146214,2022-11-24 18:21:32.921166,0 days 00:21:52.774952,<class 'torch.nn.modules.activation.ReLU'>,1024,1000000,0.0001,0.9999,0.0005814338985402612,10000,-1.1562239611788598,big,0.001,128,PRUNED
99,99,-2234.45361328125,2022-11-24 18:21:32.929216,2022-11-24 18:42:47.424989,0 days 00:21:14.495773,<class 'torch.nn.modules.activation.ReLU'>,1024,100000,0.0001,0.9999,0.0008273450166010402,10000,-1.578925873940625,big,0.001,128,PRUNED
